DROP TABLE IF EXISTS t1, t2;
CREATE TABLE t1 (b INT PRIMARY KEY);
CREATE TABLE t2 (a INT NOT NULL, b INT NOT NULL, FOREIGN KEY (b) REFERENCES t1(b) ON UPDATE CASCADE ON DELETE CASCADE);
INSERT INTO t1 (b) VALUES (100),(200),(300);
INSERT INTO t2 (a,b) VALUES (1,100),(2,200),(3,300);
INSERT INTO t2 (a,b) VALUES (4,400);
ERROR 23000: Cannot add or update a child row: a foreign key constraint fails ()
UPDATE t2 SET b=500 WHERE a=2;
ERROR 23000: Cannot add or update a child row: a foreign key constraint fails ()
UPDATE t1 SET b=400 WHERE b=300;
DELETE FROM t1 WHERE b=200;
SELECT * from t1;
b
100
400
SELECT * from t2;
a	b
1	100
3	400
DROP TABLE t2;
TRUNCATE TABLE t1;
CREATE TABLE t2 (a INT NOT NULL, b INT NOT NULL, FOREIGN KEY (b) REFERENCES t1(b) ON UPDATE CASCADE ON DELETE CASCADE);
INSERT INTO t1 (b) VALUES (100),(200),(300);
INSERT INTO t2 (a,b) VALUES (1,100),(2,200),(3,300),(4,300);
INSERT INTO t2 (a,b) VALUES (5,400);
ERROR 23000: Cannot add or update a child row: a foreign key constraint fails ()
UPDATE t2 SET b=500 WHERE a=2;
ERROR 23000: Cannot add or update a child row: a foreign key constraint fails ()
UPDATE t1 SET b=400 WHERE b=300;
DELETE FROM t1 WHERE b=200;
SELECT * from t1;
b
100
400
SELECT * from t2;
a	b
1	100
3	400
4	400
DROP TABLE t2;
DROP TABLE t1;
